,links,titles,texts,timestamp,source type
250,https://news.google.com/articles/CBMiOWh0dHBzOi8vd3d3Lmluc3RhZ3JhbS5jb20vdGhlZGVlcGFzdHJvbm9teS9wL0MzblV5MjF4S0wtL9IBAA?oc=5,"Astronomy | Space | Universe on Instagram: ""Have you ever experienced this phenomenon before?🥰 👉🏽 Video 1 & 2 ... - Instagram","<a href=""https://news.google.com/rss/articles/CBMiOWh0dHBzOi8vd3d3Lmluc3RhZ3JhbS5jb20vdGhlZGVlcGFzdHJvbm9teS9wL0MzblV5MjF4S0wtL9IBAA?oc=5"" target=""_blank"">Astronomy | Space | Universe on Instagram: ""Have you ever experienced this phenomenon before?🥰 👉🏽 Video 1 & 2 ...</a>&nbsp;&nbsp;<font color=""#6f6f6f"">Instagram</font>",21 Feb 2024 15:23:02,google
251,https://news.google.com/articles/CBMiRmh0dHBzOi8vd3d3Lmluc3RhZ3JhbS5jb20vYW1lcmljYW53YXRlcndvcmtzYXNzb2NpYXRpb24vcC9DekplSVRydVQ1ei_SAQA?oc=5,"Don't miss the new AWWA Water Science Topical Collection on Harmful Algal Blooms (HABs), featuring cutting-edge ... - Instagram","<a href=""https://news.google.com/rss/articles/CBMiRmh0dHBzOi8vd3d3Lmluc3RhZ3JhbS5jb20vYW1lcmljYW53YXRlcndvcmtzYXNzb2NpYXRpb24vcC9DekplSVRydVQ1ei_SAQA?oc=5"" target=""_blank"">Don't miss the new AWWA Water Science Topical Collection on Harmful Algal Blooms (HABs), featuring cutting-edge ...</a>&nbsp;&nbsp;<font color=""#6f6f6f"">Instagram</font>",02 Nov 2023 07:00:00,google
252,https://news.google.com/articles/CBMiK2h0dHBzOi8vd3d3Lmluc3RhZ3JhbS5jb20vcmVlbC9DeF9NS1ZDUDdvdC_SAQA?oc=5,"Alberto M. Carvalho on Instagram: ""In Case You Missed It: The algae bloom recently experienced has taken a toll on ... - Instagram","<a href=""https://news.google.com/rss/articles/CBMiK2h0dHBzOi8vd3d3Lmluc3RhZ3JhbS5jb20vcmVlbC9DeF9NS1ZDUDdvdC_SAQA?oc=5"" target=""_blank"">Alberto M. Carvalho on Instagram: ""In Case You Missed It: The algae bloom recently experienced has taken a toll on ...</a>&nbsp;&nbsp;<font color=""#6f6f6f"">Instagram</font>",04 Oct 2023 07:00:00,google
253,https://news.google.com/articles/CBMiM2h0dHBzOi8vd3d3Lmluc3RhZ3JhbS5jb20vbm9hYV9nbGVybC9wL0M0OF9ocWtNWjc2L9IBAA?oc=5,"NOAA GLERL on Instagram: ""These #WomenOfNOAA are at the forefront of advancing NOAA's Great Lakes science ... - Instagram","<a href=""https://news.google.com/rss/articles/CBMiM2h0dHBzOi8vd3d3Lmluc3RhZ3JhbS5jb20vbm9hYV9nbGVybC9wL0M0OF9ocWtNWjc2L9IBAA?oc=5"" target=""_blank"">NOAA GLERL on Instagram: ""These #WomenOfNOAA are at the forefront of advancing NOAA's Great Lakes science ...</a>&nbsp;&nbsp;<font color=""#6f6f6f"">Instagram</font>",25 Mar 2024 21:53:04,google
254,https://news.google.com/articles/CBMiN2h0dHBzOi8vd3d3Lmluc3RhZ3JhbS5jb20vY2l0eW9mZHVyaGFtbmMvcC9DNEdVQ2MwdUZnYi_SAQA?oc=5,Join us this summer for the 2024 Durham YouthWorks Program! Gain skills and earn money. 💼💵 Apply by March 19 ... - Instagram,"<a href=""https://news.google.com/rss/articles/CBMiN2h0dHBzOi8vd3d3Lmluc3RhZ3JhbS5jb20vY2l0eW9mZHVyaGFtbmMvcC9DNEdVQ2MwdUZnYi_SAQA?oc=5"" target=""_blank"">Join us this summer for the 2024 Durham YouthWorks Program! Gain skills and earn money. 💼💵 Apply by March 19 ...</a>&nbsp;&nbsp;<font color=""#6f6f6f"">Instagram</font>",04 Mar 2024 08:00:00,google
255,https://news.google.com/articles/CBMiPWh0dHBzOi8vd3d3Lmluc3RhZ3JhbS5jb20vYm96ZW1hZy9wL0N2WFl0cnRMT0RPLz9sb2NhbGU9emhfQ07SAQA?oc=5,"Instagram 用户Bozeman Magazine : ""As Montanans and visitors head to local ponds, lakes, and reservoirs for late ... - Instagram","<a href=""https://news.google.com/rss/articles/CBMiPWh0dHBzOi8vd3d3Lmluc3RhZ3JhbS5jb20vYm96ZW1hZy9wL0N2WFl0cnRMT0RPLz9sb2NhbGU9emhfQ07SAQA?oc=5"" target=""_blank"">Instagram 用户Bozeman Magazine : ""As Montanans and visitors head to local ponds, lakes, and reservoirs for late ...</a>&nbsp;&nbsp;<font color=""#6f6f6f"">Instagram</font>",31 Jul 2023 07:00:00,google
256,https://news.google.com/articles/CBMiN2h0dHBzOi8vd3d3Lmluc3RhZ3JhbS5jb20vY2l0eW9mZHVyaGFtbmMvcC9DNW9LUGhJc2I1OS_SAQA?oc=5,"City of Durham NC Government on Instagram: ""APRIL 17 WOODCROFT PARKWAY RESURFACING OPEN HOUSE ... - Instagram","<a href=""https://news.google.com/rss/articles/CBMiN2h0dHBzOi8vd3d3Lmluc3RhZ3JhbS5jb20vY2l0eW9mZHVyaGFtbmMvcC9DNW9LUGhJc2I1OS_SAQA?oc=5"" target=""_blank"">City of Durham NC Government on Instagram: ""APRIL 17 WOODCROFT PARKWAY RESURFACING OPEN HOUSE ...</a>&nbsp;&nbsp;<font color=""#6f6f6f"">Instagram</font>",11 Apr 2024 07:00:00,google
257,https://news.google.com/articles/CBMiK2h0dHBzOi8vd3d3Lmluc3RhZ3JhbS5jb20vcmVlbC9DM0RUMWgxdTZzRy_SAQA?oc=5,Instagram - Instagram,"<a href=""https://news.google.com/rss/articles/CBMiK2h0dHBzOi8vd3d3Lmluc3RhZ3JhbS5jb20vcmVlbC9DM0RUMWgxdTZzRy_SAQA?oc=5"" target=""_blank"">Instagram</a>&nbsp;&nbsp;<font color=""#6f6f6f"">Instagram</font>",07 Feb 2024 08:00:00,google
258,https://news.google.com/articles/CBMiNWh0dHBzOi8vd3d3Lmluc3RhZ3JhbS5jb20vaGFyYm9yYnJhbmNoL3AvQzJQM1hhaE02LVgv0gEA?oc=5,"Florida Atlantic Harbor Branch on Instagram: ""A new study from researchers at Florida Atlantic Harbor Branch set out to ... - Instagram","<a href=""https://news.google.com/rss/articles/CBMiNWh0dHBzOi8vd3d3Lmluc3RhZ3JhbS5jb20vaGFyYm9yYnJhbmNoL3AvQzJQM1hhaE02LVgv0gEA?oc=5"" target=""_blank"">Florida Atlantic Harbor Branch on Instagram: ""A new study from researchers at Florida Atlantic Harbor Branch set out to ...</a>&nbsp;&nbsp;<font color=""#6f6f6f"">Instagram</font>",18 Jan 2024 08:00:00,google
259,https://news.google.com/articles/CBMiKGh0dHBzOi8vd3d3Lmluc3RhZ3JhbS5jb20vcC9DdkNtLXlHcHBFNi_SAQA?oc=5,City of Durham NC Government | Join us in congratulating Christina Riordan on her recent promotion to director of our ... - Instagram,"<a href=""https://news.google.com/rss/articles/CBMiKGh0dHBzOi8vd3d3Lmluc3RhZ3JhbS5jb20vcC9DdkNtLXlHcHBFNi_SAQA?oc=5"" target=""_blank"">City of Durham NC Government | Join us in congratulating Christina Riordan on her recent promotion to director of our ...</a>&nbsp;&nbsp;<font color=""#6f6f6f"">Instagram</font>",23 Jul 2023 07:00:00,google
260,https://news.google.com/articles/CBMiN2h0dHBzOi8vd3d3Lmluc3RhZ3JhbS5jb20vY2l0eW9mZHVyaGFtbmMvcC9DMktsX0k0TXBnMS_SAQA?oc=5,"City of Durham NC Government on Instagram: ""The Durham City Council has appointed Chelsea Cook to fill their Ward ... - Instagram","<a href=""https://news.google.com/rss/articles/CBMiN2h0dHBzOi8vd3d3Lmluc3RhZ3JhbS5jb20vY2l0eW9mZHVyaGFtbmMvcC9DMktsX0k0TXBnMS_SAQA?oc=5"" target=""_blank"">City of Durham NC Government on Instagram: ""The Durham City Council has appointed Chelsea Cook to fill their Ward ...</a>&nbsp;&nbsp;<font color=""#6f6f6f"">Instagram</font>",16 Jan 2024 08:00:00,google
261,https://news.google.com/articles/CBMiN2h0dHBzOi8vd3d3Lmluc3RhZ3JhbS5jb20vY2l0eW9mZHVyaGFtbmMvcC9DM25YaFhsc0oyUy_SAQA?oc=5,City of Durham NC Government | Artist @darecoulter needs your help! Take the Artist's survey and share your ... - Instagram,"<a href=""https://news.google.com/rss/articles/CBMiN2h0dHBzOi8vd3d3Lmluc3RhZ3JhbS5jb20vY2l0eW9mZHVyaGFtbmMvcC9DM25YaFhsc0oyUy_SAQA?oc=5"" target=""_blank"">City of Durham NC Government | Artist @darecoulter needs your help! Take the Artist's survey and share your ...</a>&nbsp;&nbsp;<font color=""#6f6f6f"">Instagram</font>",21 Feb 2024 08:00:00,google
262,https://news.google.com/articles/CBMiRGh0dHBzOi8vd3d3Lmluc3RhZ3JhbS5jb20vaW5sYW5kX3NlYXNfZWR1Y2F0aW9uX2Fzc29jL3AvQzNiZW0tSlAtSUUv0gEA?oc=5,Inland Seas Ed Association | Lake Erie is the fourth-largest of the Great Lakes and is also the shallowest. While this ... - Instagram,"<a href=""https://news.google.com/rss/articles/CBMiRGh0dHBzOi8vd3d3Lmluc3RhZ3JhbS5jb20vaW5sYW5kX3NlYXNfZWR1Y2F0aW9uX2Fzc29jL3AvQzNiZW0tSlAtSUUv0gEA?oc=5"" target=""_blank"">Inland Seas Ed Association | Lake Erie is the fourth-largest of the Great Lakes and is also the shallowest. While this ...</a>&nbsp;&nbsp;<font color=""#6f6f6f"">Instagram</font>",17 Feb 2024 08:00:00,google
263,https://news.google.com/articles/CBMiQmh0dHBzOi8vd3d3Lmluc3RhZ3JhbS5jb20vbG91aXN3cGxnL3JlZWwvQ3gxc3dSU0xnMVkvP2xvY2FsZT16aC1UV9IBAA?oc=5,Louis Aguirre | Miami's Little River is one of the most polluted canals in all Miami Dade County- with nutrient levels ... - Instagram,"<a href=""https://news.google.com/rss/articles/CBMiQmh0dHBzOi8vd3d3Lmluc3RhZ3JhbS5jb20vbG91aXN3cGxnL3JlZWwvQ3gxc3dSU0xnMVkvP2xvY2FsZT16aC1UV9IBAA?oc=5"" target=""_blank"">Louis Aguirre | Miami's Little River is one of the most polluted canals in all Miami Dade County- with nutrient levels ...</a>&nbsp;&nbsp;<font color=""#6f6f6f"">Instagram</font>",08 May 2024 23:54:58,google
264,https://news.google.com/articles/CBMiNWh0dHBzOi8vd3d3Lmluc3RhZ3JhbS5jb20vbG91aXN3cGxnL3JlZWwvQzZYeDctdU9qT1ov0gEA?oc=5,Louis Aguirre | Worldwide condemnation and anger after this video goes viral showing a boat full of young partiers ... - Instagram,"<a href=""https://news.google.com/rss/articles/CBMiNWh0dHBzOi8vd3d3Lmluc3RhZ3JhbS5jb20vbG91aXN3cGxnL3JlZWwvQzZYeDctdU9qT1ov0gEA?oc=5"" target=""_blank"">Louis Aguirre | Worldwide condemnation and anger after this video goes viral showing a boat full of young partiers ...</a>&nbsp;&nbsp;<font color=""#6f6f6f"">Instagram</font>",30 Apr 2024 13:32:19,google
265,https://news.google.com/articles/CBMiNWh0dHBzOi8vd3d3Lmluc3RhZ3JhbS5jb20vb2NlYW5mb2FtL3JlZWwvQzNsblJxRXNMbWMv0gEA?oc=5,Join us for a tour of Bloom’s HQ - where they upcycle our algae into pellets for our foam rollers ♻️🌊🌿 - Instagram,"<a href=""https://news.google.com/rss/articles/CBMiNWh0dHBzOi8vd3d3Lmluc3RhZ3JhbS5jb20vb2NlYW5mb2FtL3JlZWwvQzNsblJxRXNMbWMv0gEA?oc=5"" target=""_blank"">Join us for a tour of Bloom’s HQ - where they upcycle our algae into pellets for our foam rollers ♻️🌊🌿</a>&nbsp;&nbsp;<font color=""#6f6f6f"">Instagram</font>",20 Feb 2024 08:00:00,google
266,https://news.google.com/articles/CBMiMWh0dHBzOi8vd3d3Lmluc3RhZ3JhbS5jb20vcC9DdGp0VDNFc3pVQS8_aGw9ZXMtbGHSAQA?oc=5,"NOAA GLERL en Instagram: ""NOAA GLERL is hiring an ecologist! This position will focus on field and laboratory ... - Instagram","<a href=""https://news.google.com/rss/articles/CBMiMWh0dHBzOi8vd3d3Lmluc3RhZ3JhbS5jb20vcC9DdGp0VDNFc3pVQS8_aGw9ZXMtbGHSAQA?oc=5"" target=""_blank"">NOAA GLERL en Instagram: ""NOAA GLERL is hiring an ecologist! This position will focus on field and laboratory ...</a>&nbsp;&nbsp;<font color=""#6f6f6f"">Instagram</font>",16 Jun 2023 07:00:00,google
267,https://news.google.com/articles/CBMiNGh0dHBzOi8vd3d3Lmluc3RhZ3JhbS5jb20vcmVwc2hlcnJpbGwvcC9DMFp0d0lfUjkyVS_SAQA?oc=5,"Representative Mikie Sherrill on Instagram: ""Thank you to BG Reim, his wife Patty, and the entire Picatinny Ball ... - Instagram","<a href=""https://news.google.com/rss/articles/CBMiNGh0dHBzOi8vd3d3Lmluc3RhZ3JhbS5jb20vcmVwc2hlcnJpbGwvcC9DMFp0d0lfUjkyVS_SAQA?oc=5"" target=""_blank"">Representative Mikie Sherrill on Instagram: ""Thank you to BG Reim, his wife Patty, and the entire Picatinny Ball ...</a>&nbsp;&nbsp;<font color=""#6f6f6f"">Instagram</font>",03 Dec 2023 08:00:00,google
268,https://news.google.com/articles/CBMiNWh0dHBzOi8vd3d3Lmluc3RhZ3JhbS5jb20vcm9zZW5jb2xsZWdlL3AvQzJpZWJnYXh6UzMv0gEA?oc=5,"UCF Rosen College on Instagram: "" UCF Rosen College news alert A new research study recently published in the ... - Instagram","<a href=""https://news.google.com/rss/articles/CBMiNWh0dHBzOi8vd3d3Lmluc3RhZ3JhbS5jb20vcm9zZW5jb2xsZWdlL3AvQzJpZWJnYXh6UzMv0gEA?oc=5"" target=""_blank"">UCF Rosen College on Instagram: "" UCF Rosen College news alert A new research study recently published in the ...</a>&nbsp;&nbsp;<font color=""#6f6f6f"">Instagram</font>",25 Jan 2024 08:00:00,google
269,https://news.google.com/articles/CBMiN2h0dHBzOi8vd3d3Lmluc3RhZ3JhbS5jb20vY29uc2VydmFuY3lzd2YvcC9DNGY3ajdwdG0yRS_SAQA?oc=5,"On Monday, March 11th, U.S. Department of Interior Secretary Deb Haaland, along with Assistant Secretary for Fish ... - Instagram","<a href=""https://news.google.com/rss/articles/CBMiN2h0dHBzOi8vd3d3Lmluc3RhZ3JhbS5jb20vY29uc2VydmFuY3lzd2YvcC9DNGY3ajdwdG0yRS_SAQA?oc=5"" target=""_blank"">On Monday, March 11th, U.S. Department of Interior Secretary Deb Haaland, along with Assistant Secretary for Fish ...</a>&nbsp;&nbsp;<font color=""#6f6f6f"">Instagram</font>",14 Mar 2024 07:00:00,google
270,https://news.google.com/articles/CBMiKGh0dHBzOi8vd3d3Lmluc3RhZ3JhbS5jb20vcC9DcnlhMmlET1J3Ni_SAQA?oc=5,"Natural Resources Nantucket on Instagram: ""Our team is super excited to introduce Jamison La Barge as our 2023 ... - Instagram","<a href=""https://news.google.com/rss/articles/CBMiKGh0dHBzOi8vd3d3Lmluc3RhZ3JhbS5jb20vcC9DcnlhMmlET1J3Ni_SAQA?oc=5"" target=""_blank"">Natural Resources Nantucket on Instagram: ""Our team is super excited to introduce Jamison La Barge as our 2023 ...</a>&nbsp;&nbsp;<font color=""#6f6f6f"">Instagram</font>",03 May 2023 07:00:00,google
271,https://news.google.com/articles/CBMiNGh0dHBzOi8vd3d3Lmluc3RhZ3JhbS5jb20vanJhdmlyZ2luaWEvcC9DMzVUMVlZQzFWUS_SAQA?oc=5,"James River Association on Instagram: ""The Blue crab is a Chesapeake Bay icon, scuttling sideways through brackish ... - Instagram","<a href=""https://news.google.com/rss/articles/CBMiNGh0dHBzOi8vd3d3Lmluc3RhZ3JhbS5jb20vanJhdmlyZ2luaWEvcC9DMzVUMVlZQzFWUS_SAQA?oc=5"" target=""_blank"">James River Association on Instagram: ""The Blue crab is a Chesapeake Bay icon, scuttling sideways through brackish ...</a>&nbsp;&nbsp;<font color=""#6f6f6f"">Instagram</font>",28 Feb 2024 08:00:00,google
272,https://news.google.com/articles/CBMiN2h0dHBzOi8vd3d3Lmluc3RhZ3JhbS5jb20vY29uc2VydmFuY3lzd2YvcC9DNVpkUER6QWxMLS_SAQA?oc=5,"Conservancy of SWFL on Instagram: ""It's National Wildlife Week and we are starting it off with two special stories! This ... - Instagram","<a href=""https://news.google.com/rss/articles/CBMiN2h0dHBzOi8vd3d3Lmluc3RhZ3JhbS5jb20vY29uc2VydmFuY3lzd2YvcC9DNVpkUER6QWxMLS_SAQA?oc=5"" target=""_blank"">Conservancy of SWFL on Instagram: ""It's National Wildlife Week and we are starting it off with two special stories! This ...</a>&nbsp;&nbsp;<font color=""#6f6f6f"">Instagram</font>",05 Apr 2024 22:43:31,google
273,https://news.google.com/articles/CBMiKGh0dHBzOi8vd3d3Lmluc3RhZ3JhbS5jb20vcC9DdHdZUlgwTW9Fci_SAQA?oc=5,"NOAA GLERL on Instagram: ""NOAA's Experimental Lake Erie Hypoxia Forecast is up and running for the year, and it's ... - Instagram","<a href=""https://news.google.com/rss/articles/CBMiKGh0dHBzOi8vd3d3Lmluc3RhZ3JhbS5jb20vcC9DdHdZUlgwTW9Fci_SAQA?oc=5"" target=""_blank"">NOAA GLERL on Instagram: ""NOAA's Experimental Lake Erie Hypoxia Forecast is up and running for the year, and it's ...</a>&nbsp;&nbsp;<font color=""#6f6f6f"">Instagram</font>",21 Jun 2023 07:00:00,google
274,https://news.google.com/articles/CBMiK2h0dHBzOi8vd3d3Lmluc3RhZ3JhbS5jb20vcmVlbC9DNGlKbXdRTUMyZC_SAQA?oc=5,Instagram - Instagram,"<a href=""https://news.google.com/rss/articles/CBMiK2h0dHBzOi8vd3d3Lmluc3RhZ3JhbS5jb20vcmVlbC9DNGlKbXdRTUMyZC_SAQA?oc=5"" target=""_blank"">Instagram</a>&nbsp;&nbsp;<font color=""#6f6f6f"">Instagram</font>",15 Mar 2024 07:00:00,google
275,https://news.google.com/articles/CBMiOGh0dHBzOi8vd3d3Lmluc3RhZ3JhbS5jb20vc3BydWNldG9uZWZpbG1zL3AvQzRPMGhnZVBYcFYv0gEA?oc=5,"Spruce Tone on Instagram: ""BTS of Usugilix Awakun! It takes a village, even if it's a small one. There are so many ... - Instagram","<a href=""https://news.google.com/rss/articles/CBMiOGh0dHBzOi8vd3d3Lmluc3RhZ3JhbS5jb20vc3BydWNldG9uZWZpbG1zL3AvQzRPMGhnZVBYcFYv0gEA?oc=5"" target=""_blank"">Spruce Tone on Instagram: ""BTS of Usugilix Awakun! It takes a village, even if it's a small one. There are so many ...</a>&nbsp;&nbsp;<font color=""#6f6f6f"">Instagram</font>",07 Mar 2024 23:31:52,google
276,https://news.google.com/articles/CBMiPGh0dHBzOi8vd3d3Lmluc3RhZ3JhbS5jb20vcC9Dd241UnI5SmdhYi8_cmVmPXRhYmxlaG9wcGVyLmNvbdIBAA?oc=5,"National Environmental Education Foundation on Instagram: ""Before we say goodbye to Water Quality Month, let's dig ... - Instagram","<a href=""https://news.google.com/rss/articles/CBMiPGh0dHBzOi8vd3d3Lmluc3RhZ3JhbS5jb20vcC9Dd241UnI5SmdhYi8_cmVmPXRhYmxlaG9wcGVyLmNvbdIBAA?oc=5"" target=""_blank"">National Environmental Education Foundation on Instagram: ""Before we say goodbye to Water Quality Month, let's dig ...</a>&nbsp;&nbsp;<font color=""#6f6f6f"">Instagram</font>",31 Aug 2023 07:00:00,google
277,https://news.google.com/articles/CBMiPGh0dHBzOi8vd3d3Lmluc3RhZ3JhbS5jb20vZGlhbW9uZHZhbGxleW1hcmluYS9wL0MwaUZpc19xMmZKL9IBAA?oc=5,Trout alert! We will finally be stocking our Mt.Lassen trout on 12/12/23 and you can fish for them on Wednesday 12/13 ... - Instagram,"<a href=""https://news.google.com/rss/articles/CBMiPGh0dHBzOi8vd3d3Lmluc3RhZ3JhbS5jb20vZGlhbW9uZHZhbGxleW1hcmluYS9wL0MwaUZpc19xMmZKL9IBAA?oc=5"" target=""_blank"">Trout alert! We will finally be stocking our Mt.Lassen trout on 12/12/23 and you can fish for them on Wednesday 12/13 ...</a>&nbsp;&nbsp;<font color=""#6f6f6f"">Instagram</font>",06 Dec 2023 08:00:00,google
278,https://news.google.com/articles/CBMiOGh0dHBzOi8vd3d3Lmluc3RhZ3JhbS5jb20vcmhvZGVpc2xhbmQuZGVtL3AvQzFWS2d4M3Z3eEcv0gEA?oc=5,"Rhode Island DEM on Instagram: ""Last week, the DEM Division of Fish & Wildlife (DFW) led a training session for the ... - Instagram","<a href=""https://news.google.com/rss/articles/CBMiOGh0dHBzOi8vd3d3Lmluc3RhZ3JhbS5jb20vcmhvZGVpc2xhbmQuZGVtL3AvQzFWS2d4M3Z3eEcv0gEA?oc=5"" target=""_blank"">Rhode Island DEM on Instagram: ""Last week, the DEM Division of Fish & Wildlife (DFW) led a training session for the ...</a>&nbsp;&nbsp;<font color=""#6f6f6f"">Instagram</font>",26 Dec 2023 08:00:00,google
279,https://news.google.com/articles/CBMiNGh0dHBzOi8vd3d3Lmluc3RhZ3JhbS5jb20vcmVwc2hlcnJpbGwvcC9DMi1nZ212eE9TZi_SAQA?oc=5,"Representative Mikie Sherrill on Instagram: ""The SALT deduction cap unfairly double taxes hardworking NJ families. As ... - Instagram","<a href=""https://news.google.com/rss/articles/CBMiNGh0dHBzOi8vd3d3Lmluc3RhZ3JhbS5jb20vcmVwc2hlcnJpbGwvcC9DMi1nZ212eE9TZi_SAQA?oc=5"" target=""_blank"">Representative Mikie Sherrill on Instagram: ""The SALT deduction cap unfairly double taxes hardworking NJ families. As ...</a>&nbsp;&nbsp;<font color=""#6f6f6f"">Instagram</font>",05 Feb 2024 08:00:00,google
280,https://news.google.com/articles/CBMiP2h0dHBzOi8vd3d3Lmluc3RhZ3JhbS5jb20vYWxsaWFuY2U0Z3JlYXRsYWtlcy9yZWVsL0M0R3Q4d2VQQWNZL9IBAA?oc=5,Alliance for the Great Lakes | Too many Great Lakers experience polluted water – whether it’s lead-tainted tap water or ... - Instagram,"<a href=""https://news.google.com/rss/articles/CBMiP2h0dHBzOi8vd3d3Lmluc3RhZ3JhbS5jb20vYWxsaWFuY2U0Z3JlYXRsYWtlcy9yZWVsL0M0R3Q4d2VQQWNZL9IBAA?oc=5"" target=""_blank"">Alliance for the Great Lakes | Too many Great Lakers experience polluted water – whether it’s lead-tainted tap water or ...</a>&nbsp;&nbsp;<font color=""#6f6f6f"">Instagram</font>",04 Mar 2024 08:00:00,google
281,https://news.google.com/articles/CBMiO2h0dHBzOi8vd3d3Lmluc3RhZ3JhbS5jb20vc2VhdHRsZXBhcmtzYW5kcmVjL3AvQzFJYzBUZG9Cenkv0gEA?oc=5,"Seattle Parks and Recreation on Instagram: ""ALERT! Late-season freshwater algae blooms have been noted in lakes ... - Instagram","<a href=""https://news.google.com/rss/articles/CBMiO2h0dHBzOi8vd3d3Lmluc3RhZ3JhbS5jb20vc2VhdHRsZXBhcmtzYW5kcmVjL3AvQzFJYzBUZG9Cenkv0gEA?oc=5"" target=""_blank"">Seattle Parks and Recreation on Instagram: ""ALERT! Late-season freshwater algae blooms have been noted in lakes ...</a>&nbsp;&nbsp;<font color=""#6f6f6f"">Instagram</font>",21 Dec 2023 08:00:00,google
282,https://news.google.com/articles/CBMiOGh0dHBzOi8vd3d3Lmluc3RhZ3JhbS5jb20vbmF0dXJlX2lsbGlub2lzL3AvQzQwYkRzS09fd3Qv0gEA?oc=5,"The Nature Conservancy in IL on Instagram: ""Declining fisheries. Harmful algae blooms. Extreme flooding and ... - Instagram","<a href=""https://news.google.com/rss/articles/CBMiOGh0dHBzOi8vd3d3Lmluc3RhZ3JhbS5jb20vbmF0dXJlX2lsbGlub2lzL3AvQzQwYkRzS09fd3Qv0gEA?oc=5"" target=""_blank"">The Nature Conservancy in IL on Instagram: ""Declining fisheries. Harmful algae blooms. Extreme flooding and ...</a>&nbsp;&nbsp;<font color=""#6f6f6f"">Instagram</font>",22 Mar 2024 07:00:00,google
283,https://news.google.com/articles/CBMiNGh0dHBzOi8vd3d3Lmluc3RhZ3JhbS5jb20vcmVwc2hlcnJpbGwvcC9DeTFXbGVhUjJDai_SAQA?oc=5,"Representative Mikie Sherrill on Instagram: ""Calling all NJ students interested in a career in public service: Spring 2024 ... - Instagram","<a href=""https://news.google.com/rss/articles/CBMiNGh0dHBzOi8vd3d3Lmluc3RhZ3JhbS5jb20vcmVwc2hlcnJpbGwvcC9DeTFXbGVhUjJDai_SAQA?oc=5"" target=""_blank"">Representative Mikie Sherrill on Instagram: ""Calling all NJ students interested in a career in public service: Spring 2024 ...</a>&nbsp;&nbsp;<font color=""#6f6f6f"">Instagram</font>",25 Oct 2023 07:00:00,google
284,https://news.google.com/articles/CBMiL2h0dHBzOi8vd3d3Lmluc3RhZ3JhbS5jb20va2RoZWtzL3AvQzBqc2pCUk5MRW0v0gEA?oc=5,Kansas Health & Environment | Did you know? Medicaid expansion would make behavioral health services available ... - Instagram,"<a href=""https://news.google.com/rss/articles/CBMiL2h0dHBzOi8vd3d3Lmluc3RhZ3JhbS5jb20va2RoZWtzL3AvQzBqc2pCUk5MRW0v0gEA?oc=5"" target=""_blank"">Kansas Health & Environment | Did you know? Medicaid expansion would make behavioral health services available ...</a>&nbsp;&nbsp;<font color=""#6f6f6f"">Instagram</font>",07 Dec 2023 08:00:00,google
285,https://news.google.com/articles/CBMiM2h0dHBzOi8vd3d3Lmluc3RhZ3JhbS5jb20vdXRvbGVkb21lZC9wL0MzM3NxdmR0dndIL9IBAA?oc=5,"UToledo College of Medicine on Instagram: ""The Department of Medical Microbiology and Immunology proudly ... - Instagram","<a href=""https://news.google.com/rss/articles/CBMiM2h0dHBzOi8vd3d3Lmluc3RhZ3JhbS5jb20vdXRvbGVkb21lZC9wL0MzM3NxdmR0dndIL9IBAA?oc=5"" target=""_blank"">UToledo College of Medicine on Instagram: ""The Department of Medical Microbiology and Immunology proudly ...</a>&nbsp;&nbsp;<font color=""#6f6f6f"">Instagram</font>",28 Feb 2024 08:00:00,google
286,https://news.google.com/articles/CBMiRWh0dHBzOi8vd3d3Lmluc3RhZ3JhbS5jb20vaWFtc2F0eWFtamhhL3JlZWwvQzVDd2xwVXAxUWovP2xvY2FsZT1pdF9JVNIBAA?oc=5,"Satyam Jha | Organic farming | Sustainability su Instagram : ""Agricultural Runoff: The use of fertilizers and pesticides in ... - Instagram","<a href=""https://news.google.com/rss/articles/CBMiRWh0dHBzOi8vd3d3Lmluc3RhZ3JhbS5jb20vaWFtc2F0eWFtamhhL3JlZWwvQzVDd2xwVXAxUWovP2xvY2FsZT1pdF9JVNIBAA?oc=5"" target=""_blank"">Satyam Jha | Organic farming | Sustainability su Instagram : ""Agricultural Runoff: The use of fertilizers and pesticides in ...</a>&nbsp;&nbsp;<font color=""#6f6f6f"">Instagram</font>",27 Mar 2024 07:00:00,google
287,https://news.google.com/articles/CBMiL2h0dHBzOi8vd3d3Lmluc3RhZ3JhbS5jb20va2RoZWtzL3AvQzRNU2plMHhtZGov0gEA?oc=5,"Kansas Health & Environment | In Kansas tornadoes are a common phenomenon. In 2023, there were 44 tornadoes in ... - Instagram","<a href=""https://news.google.com/rss/articles/CBMiL2h0dHBzOi8vd3d3Lmluc3RhZ3JhbS5jb20va2RoZWtzL3AvQzRNU2plMHhtZGov0gEA?oc=5"" target=""_blank"">Kansas Health & Environment | In Kansas tornadoes are a common phenomenon. In 2023, there were 44 tornadoes in ...</a>&nbsp;&nbsp;<font color=""#6f6f6f"">Instagram</font>",06 Mar 2024 08:00:00,google
288,https://news.google.com/articles/CBMiMmh0dHBzOi8vd3d3Lmluc3RhZ3JhbS5jb20vb25lbGFnb29uL3AvQzNJV2FNOVN6dTYv0gEA?oc=5,"One Lagoon on Instagram: ""NEXT WEEK! Our IRLNEP Small Grants webinar is here! This interactive webinar will ... - Instagram","<a href=""https://news.google.com/rss/articles/CBMiMmh0dHBzOi8vd3d3Lmluc3RhZ3JhbS5jb20vb25lbGFnb29uL3AvQzNJV2FNOVN6dTYv0gEA?oc=5"" target=""_blank"">One Lagoon on Instagram: ""NEXT WEEK! Our IRLNEP Small Grants webinar is here! This interactive webinar will ...</a>&nbsp;&nbsp;<font color=""#6f6f6f"">Instagram</font>",09 Feb 2024 08:00:00,google
289,https://news.google.com/articles/CBMiNmh0dHBzOi8vd3d3Lmluc3RhZ3JhbS5jb20vbWljaGlnYW5lYXJ0aC9wL0M0MGJEQXNxcldKL9IBAA?oc=5,"Michigan EARTH on Instagram: ""Today, March 22, is World Water Day as declared annually by the United Nations ... - Instagram","<a href=""https://news.google.com/rss/articles/CBMiNmh0dHBzOi8vd3d3Lmluc3RhZ3JhbS5jb20vbWljaGlnYW5lYXJ0aC9wL0M0MGJEQXNxcldKL9IBAA?oc=5"" target=""_blank"">Michigan EARTH on Instagram: ""Today, March 22, is World Water Day as declared annually by the United Nations ...</a>&nbsp;&nbsp;<font color=""#6f6f6f"">Instagram</font>",22 Mar 2024 07:00:00,google
290,https://news.google.com/articles/CBMiM2h0dHBzOi8vd3d3Lmluc3RhZ3JhbS5jb20vdXRvbGVkb21lZC9wL0MzaV9jY0FPUDM3L9IBAA?oc=5,"UToledo College of Medicine | In honor of Resident and Fellow Appreciation Week, we are excited to celebrate those ... - Instagram","<a href=""https://news.google.com/rss/articles/CBMiM2h0dHBzOi8vd3d3Lmluc3RhZ3JhbS5jb20vdXRvbGVkb21lZC9wL0MzaV9jY0FPUDM3L9IBAA?oc=5"" target=""_blank"">UToledo College of Medicine | In honor of Resident and Fellow Appreciation Week, we are excited to celebrate those ...</a>&nbsp;&nbsp;<font color=""#6f6f6f"">Instagram</font>",19 Feb 2024 08:00:00,google
291,https://news.google.com/articles/CBMiNGh0dHBzOi8vd3d3Lmluc3RhZ3JhbS5jb20vamFrZS5wbncvcmVlbC9DMXBmSG1NdjFiVS_SAQA?oc=5,Jacob Colvin | Satisfying Smashing Sea Bubbles! Is this really made from whales? It's actually decaying bio matter ... - Instagram,"<a href=""https://news.google.com/rss/articles/CBMiNGh0dHBzOi8vd3d3Lmluc3RhZ3JhbS5jb20vamFrZS5wbncvcmVlbC9DMXBmSG1NdjFiVS_SAQA?oc=5"" target=""_blank"">Jacob Colvin | Satisfying Smashing Sea Bubbles! Is this really made from whales? It's actually decaying bio matter ...</a>&nbsp;&nbsp;<font color=""#6f6f6f"">Instagram</font>",03 Jan 2024 08:00:00,google
