,links,titles,texts,timestamp,source type
0,https://news.google.com/articles/CBMiNmh0dHBzOi8vd3d3Lmluc3RhZ3JhbS5jb20vYWxhYmFtYV9fZnRibC9wL0M0MTU2Nm14VW0yL9IBAA?oc=5,"Alabama Crimson Tide on AL.com | TIDE CALLED GAME! Alabama rolled Charleston 109-96, the most points ever scored by the Crimson Tide in an NCAA Tournament game. #Alabama… | Instagram","TIDE CALLED GAME! Alabama rolled Charleston 109-96, the most points ever scored by the Crimson Tide in an NCAA Tournament game. #Alabama #Bama #RTR #RollTide #CollegeBasketball #marchmadness

📷 Patrick Greenfield AL.com",23 Mar 2024 03:49:24,instagram
1,https://news.google.com/articles/CBMiNmh0dHBzOi8vd3d3Lmluc3RhZ3JhbS5jb20vYWxhYmFtYV9fZnRibC9wL0M1S2JxOUZPeU1lL9IBAA?oc=5,Alabama Crimson Tide on AL.com | Alabama is headed to the Final Four! #RollTide #rtr #alabama #bama #marchmadness #finalfour #elite8 | Instagram,"Alabama is headed to the Final Four!

#RollTide #rtr #alabama #bama #marchmadness #finalfour #elite8",31 Mar 2024 03:09:08,instagram
2,https://news.google.com/articles/CBMiK2h0dHBzOi8vd3d3Lmluc3RhZ3JhbS5jb20vcmVlbC9DaV9Fa1Btak15OS_SAQA?oc=5,Josh Mancuso | How colleges chose their mascot: Alabama Crimson Tide 😂 . . . . . #rolltide #rolltideroll #rolltide🐘 #collegefootball #alabama… | Instagram,"How colleges chose their mascot: Alabama Crimson Tide 😂
.
.
.
.
.
#rolltide #rolltideroll #rolltide🐘 #collegefootball #alabama #alabamafootball #bama #comedy #comedian #funny #funnyvideos #hilarious #elephant #mascot #football",26 Sep 2022 21:47:10,instagram
3,https://news.google.com/articles/CBMiNmh0dHBzOi8vd3d3Lmluc3RhZ3JhbS5jb20vYWxhYmFtYV9fZnRibC9wL0M0QjNlUGh1cFRzL9IBAA?oc=5,Alabama Crimson Tide on AL.com | FOREVER FLUFF - Alabama’s honorary seat in the student section for Tide superfan Cameron Luke Ratliff aka Fluffoptamus 🐘🏀 #Alabama #RTR… | Instagram,FOREVER FLUFF - Alabama’s honorary seat in the student section for Tide superfan Cameron Luke Ratliff aka Fluffoptamus 🐘🏀 #Alabama #RTR #RollTide #AlabamaBasketball,02 Mar 2024 22:47:30,instagram
4,https://news.google.com/articles/CBMiNWh0dHBzOi8vd3d3Lmluc3RhZ3JhbS5jb20vcm9zZW5jb2xsZWdlL3AvQzJpZWJnYXh6UzMv0gEA?oc=5,UCF Rosen College | 📢 UCF Rosen College news alert 📢 A new research study recently published in the Journal of Environmental Management is the first… | Instagram,"📢 UCF Rosen College news alert 📢

A new research study recently published in the Journal of Environmental Management is the first ecosystem-scale assessment of losses to tourism-related businesses during a harmful algae bloom (HAB).

Funded by NOAA’s National Centers for Coastal and Ocean Science and led by UCF Rosen College’s own Sergio Alvarez, the study revealed that the impacts of HABs on tourism are not driven solely by biophysical elements, but are mediated and amplified by social elements like information and media coverage. The 2018 Florida red tide, resulting in approximately $2.7 billion in tourism losses, emphasizes the need to view harmful red algae blooms as potential billion-dollar disasters.

👉 Read the full story on UCF Today by visiting the link in our bio!",25 Jan 2024 21:40:50,instagram
5,https://news.google.com/articles/CBMiOGh0dHBzOi8vd3d3Lmluc3RhZ3JhbS5jb20vbXVsdG5vbWFoY291bnR5L3AvQ3YtdGdQdHBsbU4v0gEA?oc=5,"Multnomah County on Instagram: ""ALERT: Toxic algae has been detected on the Willamette River in Portland and ... - Instagram","<a href=""https://news.google.com/rss/articles/CBMiOGh0dHBzOi8vd3d3Lmluc3RhZ3JhbS5jb20vbXVsdG5vbWFoY291bnR5L3AvQ3YtdGdQdHBsbU4v0gEA?oc=5"" target=""_blank"">Multnomah County on Instagram: ""ALERT: Toxic algae has been detected on the Willamette River in Portland and ...</a>&nbsp;&nbsp;<font color=""#6f6f6f"">Instagram</font>",15 Aug 2023 07:00:00,google
6,https://news.google.com/articles/CBMiR2h0dHBzOi8vd3d3Lmluc3RhZ3JhbS5jb20vcmVlbC9DdVBoelFGTjRwOC8_aWdzaGlkPU5UYzRNVEl3TmpRMllRJTNEJTNE0gEA?oc=5,OC Supervisor Katrina Foley | Today I joined @msnbc’s Ana Cabrera Reports to warn beach goers & residents about ... - Instagram,"<a href=""https://news.google.com/rss/articles/CBMiR2h0dHBzOi8vd3d3Lmluc3RhZ3JhbS5jb20vcmVlbC9DdVBoelFGTjRwOC8_aWdzaGlkPU5UYzRNVEl3TmpRMllRJTNEJTNE0gEA?oc=5"" target=""_blank"">OC Supervisor Katrina Foley | Today I joined @msnbc’s Ana Cabrera Reports to warn beach goers & residents about ...</a>&nbsp;&nbsp;<font color=""#6f6f6f"">Instagram</font>",03 Jul 2023 07:00:00,google
7,https://news.google.com/articles/CBMiN2h0dHBzOi8vd3d3Lmluc3RhZ3JhbS5jb20vYXVzdGludGV4YXNnb3YvcC9Dc3RjQWY2TGtaSi_SAQA?oc=5,"City of Austin on Instagram: ""Blue-green algae is present on Lady Bird Lake + Lake Austin. Please assume algae may ... - Instagram","<a href=""https://news.google.com/rss/articles/CBMiN2h0dHBzOi8vd3d3Lmluc3RhZ3JhbS5jb20vYXVzdGludGV4YXNnb3YvcC9Dc3RjQWY2TGtaSi_SAQA?oc=5"" target=""_blank"">City of Austin on Instagram: ""Blue-green algae is present on Lady Bird Lake + Lake Austin. Please assume algae may ...</a>&nbsp;&nbsp;<font color=""#6f6f6f"">Instagram</font>",26 May 2023 07:00:00,google
8,https://news.google.com/articles/CBMiPGh0dHBzOi8vd3d3Lmluc3RhZ3JhbS5jb20vbWFyaW5lbWFtbWFsY2FyZS9yZWVsL0N3ZFIwQy1oVG9XL9IBAA?oc=5,"Marine Mammal Care Center on Instagram: ""📺️ CNN: Sea Lions Sickened by Toxic Algae Breakout Released Back ... - Instagram","<a href=""https://news.google.com/rss/articles/CBMiPGh0dHBzOi8vd3d3Lmluc3RhZ3JhbS5jb20vbWFyaW5lbWFtbWFsY2FyZS9yZWVsL0N3ZFIwQy1oVG9XL9IBAA?oc=5"" target=""_blank"">Marine Mammal Care Center on Instagram: ""📺️ CNN: Sea Lions Sickened by Toxic Algae Breakout Released Back ...</a>&nbsp;&nbsp;<font color=""#6f6f6f"">Instagram</font>",27 Aug 2023 07:00:00,google
9,https://news.google.com/articles/CBMiO2h0dHBzOi8vd3d3Lmluc3RhZ3JhbS5jb20vaW5zcGVjdG9ycGxhbmV0L3JlZWwvQzVXd0d2cnVCQ2gv0gEA?oc=5,"Dr. Tracy Fanara on Instagram: ""Lake Okeechobee algae blooms can be seen from Space! Satellite imagery can give ... - Instagram","<a href=""https://news.google.com/rss/articles/CBMiO2h0dHBzOi8vd3d3Lmluc3RhZ3JhbS5jb20vaW5zcGVjdG9ycGxhbmV0L3JlZWwvQzVXd0d2cnVCQ2gv0gEA?oc=5"" target=""_blank"">Dr. Tracy Fanara on Instagram: ""Lake Okeechobee algae blooms can be seen from Space! Satellite imagery can give ...</a>&nbsp;&nbsp;<font color=""#6f6f6f"">Instagram</font>",04 Apr 2024 07:00:00,google
10,https://news.google.com/articles/CBMiMWh0dHBzOi8vd3d3Lmluc3RhZ3JhbS5jb20vZXZ5a2F5YWsvcC9DM2hyTlQwU0NDZC_SAQA?oc=5,"Evy Leibfarth on Instagram: ""AUS camera roll!! Trip was cut short by some toxic algae but still got 6 weeks of awesome ... - Instagram","<a href=""https://news.google.com/rss/articles/CBMiMWh0dHBzOi8vd3d3Lmluc3RhZ3JhbS5jb20vZXZ5a2F5YWsvcC9DM2hyTlQwU0NDZC_SAQA?oc=5"" target=""_blank"">Evy Leibfarth on Instagram: ""AUS camera roll!! Trip was cut short by some toxic algae but still got 6 weeks of awesome ...</a>&nbsp;&nbsp;<font color=""#6f6f6f"">Instagram</font>",19 Feb 2024 08:00:00,google
11,https://news.google.com/articles/CBMiMmh0dHBzOi8vd3d3Lmluc3RhZ3JhbS5jb20vbGFuZWVpZ2h0L3AvQzJOS1VZMXZPODgv0gEA?oc=5,"Powered by algae. Did you know that our comfy, responsive midsoles are made from algae? In partnership with ... - Instagram","<a href=""https://news.google.com/rss/articles/CBMiMmh0dHBzOi8vd3d3Lmluc3RhZ3JhbS5jb20vbGFuZWVpZ2h0L3AvQzJOS1VZMXZPODgv0gEA?oc=5"" target=""_blank"">Powered by algae. Did you know that our comfy, responsive midsoles are made from algae? In partnership with ...</a>&nbsp;&nbsp;<font color=""#6f6f6f"">Instagram</font>",17 Jan 2024 08:00:00,google
12,https://news.google.com/articles/CBMiW2h0dHBzOi8vd3d3Lmluc3RhZ3JhbS5jb20vZG9nc25hdHVyYWxseW1hZ2F6aW5lL3AvQ3c4a2E5QnN6WGQvP3JlZj1tYWRpc29ubWludXRlcy5jb20maGw9YWbSAQA?oc=5,"Dogs Naturally op Instagram : "" Blue-green algae can look like “pea soup” scum on the water or discolored water … but ... - Instagram","<a href=""https://news.google.com/rss/articles/CBMiW2h0dHBzOi8vd3d3Lmluc3RhZ3JhbS5jb20vZG9nc25hdHVyYWxseW1hZ2F6aW5lL3AvQ3c4a2E5QnN6WGQvP3JlZj1tYWRpc29ubWludXRlcy5jb20maGw9YWbSAQA?oc=5"" target=""_blank"">Dogs Naturally op Instagram : "" Blue-green algae can look like “pea soup” scum on the water or discolored water … but ...</a>&nbsp;&nbsp;<font color=""#6f6f6f"">Instagram</font>",08 Sep 2023 07:00:00,google
13,https://news.google.com/articles/CBMiOmh0dHBzOi8vd3d3Lmluc3RhZ3JhbS5jb20vc2lsdmVyd29vZGxha2VzcmEvcC9DeUU0amswdklKZi_SAQA?oc=5,"Silverwood Lake SRA | ⚠️ WARNING ADVISORY, TOXIC BLUE-GREEN ALAGE. SWIMMING PROHIBITED ⚠️ New ... - Instagram","<a href=""https://news.google.com/rss/articles/CBMiOmh0dHBzOi8vd3d3Lmluc3RhZ3JhbS5jb20vc2lsdmVyd29vZGxha2VzcmEvcC9DeUU0amswdklKZi_SAQA?oc=5"" target=""_blank"">Silverwood Lake SRA | ⚠️ WARNING ADVISORY, TOXIC BLUE-GREEN ALAGE. SWIMMING PROHIBITED ⚠️ New ...</a>&nbsp;&nbsp;<font color=""#6f6f6f"">Instagram</font>",06 Oct 2023 07:00:00,google
14,https://news.google.com/articles/CBMiOGh0dHBzOi8vd3d3Lmluc3RhZ3JhbS5jb20vcmhvZGVpc2xhbmQuZGVtL3AvQ3o2X0pkYXZXTzYv0gEA?oc=5,"Rhode Island DEM on Instagram: ""Blue-Green Algae Bloom at Indian Lake. The Rhode Island Department of Health ... - Instagram","<a href=""https://news.google.com/rss/articles/CBMiOGh0dHBzOi8vd3d3Lmluc3RhZ3JhbS5jb20vcmhvZGVpc2xhbmQuZGVtL3AvQ3o2X0pkYXZXTzYv0gEA?oc=5"" target=""_blank"">Rhode Island DEM on Instagram: ""Blue-Green Algae Bloom at Indian Lake. The Rhode Island Department of Health ...</a>&nbsp;&nbsp;<font color=""#6f6f6f"">Instagram</font>",21 Nov 2023 08:00:00,google
15,https://news.google.com/articles/CBMiOWh0dHBzOi8vd3d3Lmluc3RhZ3JhbS5jb20vbWFyaW5lbWFtbWFsY2FyZS9wL0M1MVZRcjhzQ3drL9IBAA?oc=5,"Marine Mammal Care Center on Instagram: "" Home sweet home! Thank you for your generous support of ocean ... - Instagram","<a href=""https://news.google.com/rss/articles/CBMiOWh0dHBzOi8vd3d3Lmluc3RhZ3JhbS5jb20vbWFyaW5lbWFtbWFsY2FyZS9wL0M1MVZRcjhzQ3drL9IBAA?oc=5"" target=""_blank"">Marine Mammal Care Center on Instagram: "" Home sweet home! Thank you for your generous support of ocean ...</a>&nbsp;&nbsp;<font color=""#6f6f6f"">Instagram</font>",16 Apr 2024 19:00:28,google
16,https://news.google.com/articles/CBMiOGh0dHBzOi8vd3d3Lmluc3RhZ3JhbS5jb20vbmF0dXJlX2lsbGlub2lzL3AvQzQwYkRzS09fd3Qv0gEA?oc=5,"The Nature Conservancy in IL on Instagram: ""Declining fisheries. Harmful algae blooms. Extreme flooding and ... - Instagram","<a href=""https://news.google.com/rss/articles/CBMiOGh0dHBzOi8vd3d3Lmluc3RhZ3JhbS5jb20vbmF0dXJlX2lsbGlub2lzL3AvQzQwYkRzS09fd3Qv0gEA?oc=5"" target=""_blank"">The Nature Conservancy in IL on Instagram: ""Declining fisheries. Harmful algae blooms. Extreme flooding and ...</a>&nbsp;&nbsp;<font color=""#6f6f6f"">Instagram</font>",22 Mar 2024 07:00:00,google
17,https://news.google.com/articles/CBMiPGh0dHBzOi8vd3d3Lmluc3RhZ3JhbS5jb20vbWFyaW5lbWFtbWFsY2FyZS9yZWVsL0M0b25lTXd2RkYwL9IBAA?oc=5,"Marine Mammal Care Center on Instagram: ""🏎️ Part 2 of our VIRAL video with over 1M views! Check out this ... - Instagram","<a href=""https://news.google.com/rss/articles/CBMiPGh0dHBzOi8vd3d3Lmluc3RhZ3JhbS5jb20vbWFyaW5lbWFtbWFsY2FyZS9yZWVsL0M0b25lTXd2RkYwL9IBAA?oc=5"" target=""_blank"">Marine Mammal Care Center on Instagram: ""🏎️ Part 2 of our VIRAL video with over 1M views! Check out this ...</a>&nbsp;&nbsp;<font color=""#6f6f6f"">Instagram</font>",17 Mar 2024 07:00:00,google
18,https://news.google.com/articles/CBMiOWh0dHBzOi8vd3d3Lmluc3RhZ3JhbS5jb20vbWFyaW5lbWFtbWFsY2FyZS9wL0M1alhSOERQUjlyL9IBAA?oc=5,"Marine Mammal Care Center | 🚨 Meet one of our newest elephant seal pups who was rescued in Abalone Cove, Palos ... - Instagram","<a href=""https://news.google.com/rss/articles/CBMiOWh0dHBzOi8vd3d3Lmluc3RhZ3JhbS5jb20vbWFyaW5lbWFtbWFsY2FyZS9wL0M1alhSOERQUjlyL9IBAA?oc=5"" target=""_blank"">Marine Mammal Care Center | 🚨 Meet one of our newest elephant seal pups who was rescued in Abalone Cove, Palos ...</a>&nbsp;&nbsp;<font color=""#6f6f6f"">Instagram</font>",09 Apr 2024 07:00:00,google
19,https://news.google.com/articles/CBMiOWh0dHBzOi8vd3d3Lmluc3RhZ3JhbS5jb20vbWFyaW5lbWFtbWFsY2FyZS9wL0MyNVBMRW5zU1RpL9IBAA?oc=5,"Marine Mammal Care Center on Instagram: "" Happy Spotlight Saturday! Meet Kate, one of our wonderful education and ... - Instagram","<a href=""https://news.google.com/rss/articles/CBMiOWh0dHBzOi8vd3d3Lmluc3RhZ3JhbS5jb20vbWFyaW5lbWFtbWFsY2FyZS9wL0MyNVBMRW5zU1RpL9IBAA?oc=5"" target=""_blank"">Marine Mammal Care Center on Instagram: "" Happy Spotlight Saturday! Meet Kate, one of our wonderful education and ...</a>&nbsp;&nbsp;<font color=""#6f6f6f"">Instagram</font>",03 Feb 2024 08:00:00,google
20,https://news.google.com/articles/CBMiOWh0dHBzOi8vd3d3Lmluc3RhZ3JhbS5jb20vbWFyaW5lbWFtbWFsY2FyZS9wL0MwUHhJNVB2ek1ZL9IBAA?oc=5,"Marine Mammal Care Center on Instagram: ""🗑️ Young sea lion entangled in packing strap Meet Merci, a sweet ... - Instagram","<a href=""https://news.google.com/rss/articles/CBMiOWh0dHBzOi8vd3d3Lmluc3RhZ3JhbS5jb20vbWFyaW5lbWFtbWFsY2FyZS9wL0MwUHhJNVB2ek1ZL9IBAA?oc=5"" target=""_blank"">Marine Mammal Care Center on Instagram: ""🗑️ Young sea lion entangled in packing strap Meet Merci, a sweet ...</a>&nbsp;&nbsp;<font color=""#6f6f6f"">Instagram</font>",29 Nov 2023 08:00:00,google
21,https://news.google.com/articles/CBMiOWh0dHBzOi8vd3d3Lmluc3RhZ3JhbS5jb20vbWFyaW5lbWFtbWFsY2FyZS9wL0MxYVFVWnVQS3NFL9IBAA?oc=5,"Marine Mammal Care Center | ❤️ WOW! With your support, so much was achieved for our ocean planet in 2023! Your ... - Instagram","<a href=""https://news.google.com/rss/articles/CBMiOWh0dHBzOi8vd3d3Lmluc3RhZ3JhbS5jb20vbWFyaW5lbWFtbWFsY2FyZS9wL0MxYVFVWnVQS3NFL9IBAA?oc=5"" target=""_blank"">Marine Mammal Care Center | ❤️ WOW! With your support, so much was achieved for our ocean planet in 2023! Your ...</a>&nbsp;&nbsp;<font color=""#6f6f6f"">Instagram</font>",28 Dec 2023 08:00:00,google
22,https://news.google.com/articles/CBMiOWh0dHBzOi8vd3d3Lmluc3RhZ3JhbS5jb20vbWFyaW5lbWFtbWFsY2FyZS9wL0MyQXkzWUR1YVI4L9IBAA?oc=5,"Marine Mammal Care Center on Instagram: "" Please spread the word: To report sick, injured or abandoned seals or ... - Instagram","<a href=""https://news.google.com/rss/articles/CBMiOWh0dHBzOi8vd3d3Lmluc3RhZ3JhbS5jb20vbWFyaW5lbWFtbWFsY2FyZS9wL0MyQXkzWUR1YVI4L9IBAA?oc=5"" target=""_blank"">Marine Mammal Care Center on Instagram: "" Please spread the word: To report sick, injured or abandoned seals or ...</a>&nbsp;&nbsp;<font color=""#6f6f6f"">Instagram</font>",12 Jan 2024 08:00:00,google
23,https://news.google.com/articles/CBMiQ2h0dHBzOi8vd3d3Lmluc3RhZ3JhbS5jb20vZ29zZ2xyZy9yZWVsL0Mxa2VEbEh2bWpHLz9hcGk9cG9zdE1lc3NhZ2XSAQA?oc=5,Seattle Greenlake Running | 💦 2024 SGLRG Annual Run & Plunge! Happy New Year!! 🦠 Golden Gardens this year ... - Instagram,"<a href=""https://news.google.com/rss/articles/CBMiQ2h0dHBzOi8vd3d3Lmluc3RhZ3JhbS5jb20vZ29zZ2xyZy9yZWVsL0Mxa2VEbEh2bWpHLz9hcGk9cG9zdE1lc3NhZ2XSAQA?oc=5"" target=""_blank"">Seattle Greenlake Running | 💦 2024 SGLRG Annual Run & Plunge! Happy New Year!! 🦠 Golden Gardens this year ...</a>&nbsp;&nbsp;<font color=""#6f6f6f"">Instagram</font>",01 Jan 2024 08:00:00,google
24,https://news.google.com/articles/CBMiOWh0dHBzOi8vd3d3Lmluc3RhZ3JhbS5jb20vbWFyaW5lbWFtbWFsY2FyZS9wL0N3M0hYeGRObGVfL9IBAA?oc=5,"Marine Mammal Care Center on Instagram: "" This sweet elephant seal patient is wishing you a good day! Did you know ... - Instagram","<a href=""https://news.google.com/rss/articles/CBMiOWh0dHBzOi8vd3d3Lmluc3RhZ3JhbS5jb20vbWFyaW5lbWFtbWFsY2FyZS9wL0N3M0hYeGRObGVfL9IBAA?oc=5"" target=""_blank"">Marine Mammal Care Center on Instagram: "" This sweet elephant seal patient is wishing you a good day! Did you know ...</a>&nbsp;&nbsp;<font color=""#6f6f6f"">Instagram</font>",06 Sep 2023 07:00:00,google
25,https://news.google.com/articles/CBMiR2h0dHBzOi8vd3d3Lmluc3RhZ3JhbS5jb20vYW15Ym93ZXJzY29yZGFsaXMvcC9DMkIwcF9VTDZkOC8_bG9jYWxlPWVuLXVz0gEA?oc=5,"Amy Bowers Cordalis on Instagram: ""The klamath river morning of iron gate reservoir draw down, the receding water in ... - Instagram","<a href=""https://news.google.com/rss/articles/CBMiR2h0dHBzOi8vd3d3Lmluc3RhZ3JhbS5jb20vYW15Ym93ZXJzY29yZGFsaXMvcC9DMkIwcF9VTDZkOC8_bG9jYWxlPWVuLXVz0gEA?oc=5"" target=""_blank"">Amy Bowers Cordalis on Instagram: ""The klamath river morning of iron gate reservoir draw down, the receding water in ...</a>&nbsp;&nbsp;<font color=""#6f6f6f"">Instagram</font>",12 Jan 2024 08:00:00,google
26,https://news.google.com/articles/CBMiOGh0dHBzOi8vd3d3Lmluc3RhZ3JhbS5jb20vd2Fsc2h1bml2ZXJzaXR5L3AvQzNGekE4SU92OWkv0gEA?oc=5,"Walsh University on Instagram: ""Ray Risden, Director of the Center for Scientific Excellence, and Environmental ... - Instagram","<a href=""https://news.google.com/rss/articles/CBMiOGh0dHBzOi8vd3d3Lmluc3RhZ3JhbS5jb20vd2Fsc2h1bml2ZXJzaXR5L3AvQzNGekE4SU92OWkv0gEA?oc=5"" target=""_blank"">Walsh University on Instagram: ""Ray Risden, Director of the Center for Scientific Excellence, and Environmental ...</a>&nbsp;&nbsp;<font color=""#6f6f6f"">Instagram</font>",08 Feb 2024 08:00:00,google
27,https://news.google.com/articles/CBMiK2h0dHBzOi8vd3d3Lmluc3RhZ3JhbS5jb20vcmVlbC9DNDNLYUdiTUJHRC_SAQA?oc=5,Laxmi Prajapati | Filamentous blue green algae https://youtube.com/shorts/eM-X4fYXONQ?si=fjDY_7GyW5LEZGwV ... - Instagram,"<a href=""https://news.google.com/rss/articles/CBMiK2h0dHBzOi8vd3d3Lmluc3RhZ3JhbS5jb20vcmVlbC9DNDNLYUdiTUJHRC_SAQA?oc=5"" target=""_blank"">Laxmi Prajapati | Filamentous blue green algae https://youtube.com/shorts/eM-X4fYXONQ?si=fjDY_7GyW5LEZGwV ...</a>&nbsp;&nbsp;<font color=""#6f6f6f"">Instagram</font>",23 Mar 2024 07:00:00,google
28,https://news.google.com/articles/CBMiOWh0dHBzOi8vd3d3Lmluc3RhZ3JhbS5jb20vbWFyaW5lbWFtbWFsY2FyZS9wL0M0T3VCUER2SVNSL9IBAA?oc=5,Marine Mammal Care Center | 👋 Meet Florence and Lennox (Pt. 1) two of the four sea lions who were released this ... - Instagram,"<a href=""https://news.google.com/rss/articles/CBMiOWh0dHBzOi8vd3d3Lmluc3RhZ3JhbS5jb20vbWFyaW5lbWFtbWFsY2FyZS9wL0M0T3VCUER2SVNSL9IBAA?oc=5"" target=""_blank"">Marine Mammal Care Center | 👋 Meet Florence and Lennox (Pt. 1) two of the four sea lions who were released this ...</a>&nbsp;&nbsp;<font color=""#6f6f6f"">Instagram</font>",07 Mar 2024 08:00:00,google
29,https://news.google.com/articles/CBMiOWh0dHBzOi8vd3d3Lmluc3RhZ3JhbS5jb20vZnJhbmtsaW5qdWljZS9yZWVsL0M0T0hPUXJMaUQwL9IBAA?oc=5,"FRANKLIN JUICE CO | SPIRULINA, “a type of blue-green algae that grows in both salt and fresh water. It is highly ... - Instagram","<a href=""https://news.google.com/rss/articles/CBMiOWh0dHBzOi8vd3d3Lmluc3RhZ3JhbS5jb20vZnJhbmtsaW5qdWljZS9yZWVsL0M0T0hPUXJMaUQwL9IBAA?oc=5"" target=""_blank"">FRANKLIN JUICE CO | SPIRULINA, “a type of blue-green algae that grows in both salt and fresh water. It is highly ...</a>&nbsp;&nbsp;<font color=""#6f6f6f"">Instagram</font>",07 Mar 2024 08:00:00,google
30,https://news.google.com/articles/CBMiO2h0dHBzOi8vd3d3Lmluc3RhZ3JhbS5jb20vbm9ydGhob3VuZC5saWZlL3JlZWwvQzVaYjBIanBkNlAv0gEA?oc=5,"North Hound Life on Instagram: ""Spirulina, a superfood derived from blue-green algae, is packed with nutrients and can ... - Instagram","<a href=""https://news.google.com/rss/articles/CBMiO2h0dHBzOi8vd3d3Lmluc3RhZ3JhbS5jb20vbm9ydGhob3VuZC5saWZlL3JlZWwvQzVaYjBIanBkNlAv0gEA?oc=5"" target=""_blank"">North Hound Life on Instagram: ""Spirulina, a superfood derived from blue-green algae, is packed with nutrients and can ...</a>&nbsp;&nbsp;<font color=""#6f6f6f"">Instagram</font>",05 Apr 2024 07:00:00,google
31,https://news.google.com/articles/CBMiPWh0dHBzOi8vd3d3Lmluc3RhZ3JhbS5jb20vc3RlbWNlbGxjaHJpc3RpYW4vcmVlbC9DelUzbm56T0VGNy_SAQA?oc=5,Christian Drapeau | So…AFA blue-green algae can help boost NK cells for more immune defense? You read that right ... - Instagram,"<a href=""https://news.google.com/rss/articles/CBMiPWh0dHBzOi8vd3d3Lmluc3RhZ3JhbS5jb20vc3RlbWNlbGxjaHJpc3RpYW4vcmVlbC9DelUzbm56T0VGNy_SAQA?oc=5"" target=""_blank"">Christian Drapeau | So…AFA blue-green algae can help boost NK cells for more immune defense? You read that right ...</a>&nbsp;&nbsp;<font color=""#6f6f6f"">Instagram</font>",06 Nov 2023 08:00:00,google
32,https://news.google.com/articles/CBMiPmh0dHBzOi8vd3d3Lmluc3RhZ3JhbS5jb20vY2FwdGFpbnNmb3JjbGVhbndhdGVyL3AvQzJTV1BFNk9oVzcv0gEA?oc=5,📢 New study reveals the true cost of a Harmful Algal Bloom.⁠ ⁠ We partnered with @sccf_swfl and @conservancyswf ... - Instagram,"<a href=""https://news.google.com/rss/articles/CBMiPmh0dHBzOi8vd3d3Lmluc3RhZ3JhbS5jb20vY2FwdGFpbnNmb3JjbGVhbndhdGVyL3AvQzJTV1BFNk9oVzcv0gEA?oc=5"" target=""_blank"">📢 New study reveals the true cost of a Harmful Algal Bloom.⁠ ⁠ We partnered with @sccf_swfl and @conservancyswf ...</a>&nbsp;&nbsp;<font color=""#6f6f6f"">Instagram</font>",19 Jan 2024 08:00:00,google
33,https://news.google.com/articles/CBMiOWh0dHBzOi8vd3d3Lmluc3RhZ3JhbS5jb20vZXJib2xvZ3lvZmZpY2lhbC9wL0MzQWdrUE50NTE0L9IBAA?oc=5,"🍵 Spirulina, a type of blue-green algae, is renowned for its abundance of nutrients and potential health benefits. Firstly ... - Instagram","<a href=""https://news.google.com/rss/articles/CBMiOWh0dHBzOi8vd3d3Lmluc3RhZ3JhbS5jb20vZXJib2xvZ3lvZmZpY2lhbC9wL0MzQWdrUE50NTE0L9IBAA?oc=5"" target=""_blank"">🍵 Spirulina, a type of blue-green algae, is renowned for its abundance of nutrients and potential health benefits. Firstly ...</a>&nbsp;&nbsp;<font color=""#6f6f6f"">Instagram</font>",06 Feb 2024 08:00:00,google
34,https://news.google.com/articles/CBMiO2h0dHBzOi8vd3d3Lmluc3RhZ3JhbS5jb20vcmhvZGVpc2xhbmQuZGVtL3JlZWwvQzVtU1RXM1A1Z2sv0gEA?oc=5,"Rhode Island DEM on Instagram: ""Within two weeks of rescuing the passengers whose plane had crashed in ... - Instagram","<a href=""https://news.google.com/rss/articles/CBMiO2h0dHBzOi8vd3d3Lmluc3RhZ3JhbS5jb20vcmhvZGVpc2xhbmQuZGVtL3JlZWwvQzVtU1RXM1A1Z2sv0gEA?oc=5"" target=""_blank"">Rhode Island DEM on Instagram: ""Within two weeks of rescuing the passengers whose plane had crashed in ...</a>&nbsp;&nbsp;<font color=""#6f6f6f"">Instagram</font>",10 Apr 2024 07:00:00,google
35,https://news.google.com/articles/CBMiOGh0dHBzOi8vd3d3Lmluc3RhZ3JhbS5jb20vcmhvZGVpc2xhbmQuZGVtL3AvQzE1QzI4RHNldWov0gEA?oc=5,"Rhode Island DEM on Instagram: ""Last Month, Chief Dean Hoxsie of DEM's Division of Law Enforcement (DLE ... - Instagram","<a href=""https://news.google.com/rss/articles/CBMiOGh0dHBzOi8vd3d3Lmluc3RhZ3JhbS5jb20vcmhvZGVpc2xhbmQuZGVtL3AvQzE1QzI4RHNldWov0gEA?oc=5"" target=""_blank"">Rhode Island DEM on Instagram: ""Last Month, Chief Dean Hoxsie of DEM's Division of Law Enforcement (DLE ...</a>&nbsp;&nbsp;<font color=""#6f6f6f"">Instagram</font>",09 Jan 2024 08:00:00,google
36,https://news.google.com/articles/CBMiO2h0dHBzOi8vd3d3Lmluc3RhZ3JhbS5jb20vdmJlenkvcC9DNWVqVTFycll3VC8_bG9jYWxlPXB0X1BU0gEA?oc=5,"Vanessa Bézy, PhD no Instagram: ""Algal bloom in the Rio Nosara. In the dry season, there is no rain to carry pollution ... - Instagram","<a href=""https://news.google.com/rss/articles/CBMiO2h0dHBzOi8vd3d3Lmluc3RhZ3JhbS5jb20vdmJlenkvcC9DNWVqVTFycll3VC8_bG9jYWxlPXB0X1BU0gEA?oc=5"" target=""_blank"">Vanessa Bézy, PhD no Instagram: ""Algal bloom in the Rio Nosara. In the dry season, there is no rain to carry pollution ...</a>&nbsp;&nbsp;<font color=""#6f6f6f"">Instagram</font>",07 Apr 2024 07:00:00,google
37,https://news.google.com/articles/CBMiPWh0dHBzOi8vd3d3Lmluc3RhZ3JhbS5jb20vc3RlbWNlbGxjaHJpc3RpYW4vcmVlbC9DdS1iS2JNTklTVC_SAQA?oc=5,"Christian Drapeau on Instagram: ""What is the proper dosage of AFA Blue-green algae to feel the health benefits? Well ... - Instagram","<a href=""https://news.google.com/rss/articles/CBMiPWh0dHBzOi8vd3d3Lmluc3RhZ3JhbS5jb20vc3RlbWNlbGxjaHJpc3RpYW4vcmVlbC9DdS1iS2JNTklTVC_SAQA?oc=5"" target=""_blank"">Christian Drapeau on Instagram: ""What is the proper dosage of AFA Blue-green algae to feel the health benefits? Well ...</a>&nbsp;&nbsp;<font color=""#6f6f6f"">Instagram</font>",21 Jul 2023 07:00:00,google
38,https://news.google.com/articles/CBMiOWh0dHBzOi8vd3d3Lmluc3RhZ3JhbS5jb20vbWFyaW5lbWFtbWFsY2FyZS9wL0MwSzQxT2hKTE9tL9IBAA?oc=5,🎉📺 Join us tomorrow LIVE on IG & FB for a GivingTuesday Celebration Release at (estimated) 8:30 am and Feeding ... - Instagram,"<a href=""https://news.google.com/rss/articles/CBMiOWh0dHBzOi8vd3d3Lmluc3RhZ3JhbS5jb20vbWFyaW5lbWFtbWFsY2FyZS9wL0MwSzQxT2hKTE9tL9IBAA?oc=5"" target=""_blank"">🎉📺 Join us tomorrow LIVE on IG & FB for a GivingTuesday Celebration Release at (estimated) 8:30 am and Feeding ...</a>&nbsp;&nbsp;<font color=""#6f6f6f"">Instagram</font>",27 Nov 2023 08:00:00,google
39,https://news.google.com/articles/CBMiOWh0dHBzOi8vd3d3Lmluc3RhZ3JhbS5jb20vbWFyaW5lbWFtbWFsY2FyZS9wL0M0Z2JFakN2Sll6L9IBAA?oc=5,"Marine Mammal Care Center on Instagram: "" It's Pi Day so it's only fitting that you meet Pie who was rescued this ... - Instagram","<a href=""https://news.google.com/rss/articles/CBMiOWh0dHBzOi8vd3d3Lmluc3RhZ3JhbS5jb20vbWFyaW5lbWFtbWFsY2FyZS9wL0M0Z2JFakN2Sll6L9IBAA?oc=5"" target=""_blank"">Marine Mammal Care Center on Instagram: "" It's Pi Day so it's only fitting that you meet Pie who was rescued this ...</a>&nbsp;&nbsp;<font color=""#6f6f6f"">Instagram</font>",14 Mar 2024 07:00:00,google
40,https://news.google.com/articles/CBMiRmh0dHBzOi8vd3d3Lmluc3RhZ3JhbS5jb20vdGhlLnBzeWNob2xvZ2lzdC5udXRyaXRpb25pc3QvcC9DellnUnV6TGNkMC_SAQA?oc=5,"Colby | Psychology Coach | Spirulina is a blue-green algae that grows is warm, alkaline fresh waters around the world ... - Instagram","<a href=""https://news.google.com/rss/articles/CBMiRmh0dHBzOi8vd3d3Lmluc3RhZ3JhbS5jb20vdGhlLnBzeWNob2xvZ2lzdC5udXRyaXRpb25pc3QvcC9DellnUnV6TGNkMC_SAQA?oc=5"" target=""_blank"">Colby | Psychology Coach | Spirulina is a blue-green algae that grows is warm, alkaline fresh waters around the world ...</a>&nbsp;&nbsp;<font color=""#6f6f6f"">Instagram</font>",08 Nov 2023 08:00:00,google
